curr_id,career
25520051102782,นักจัดการด้านการออกแบบ และนวัตกรรมสังคม (Design and Social Innovation Officer)
25520051102782,นักพัฒนาการออกแบบในหน่วยงานภาครัฐ (Design Development Officer in Government Agencies)และนักออกแบบกิจกรรมเพื่อสังคม (Social Activity Designer)
25520051102782,ผู้ประกอบการทางสังคมด้านการออกแบบ (Social Entrepreneur in Design)
25520051102782,ผู้ประกอบการธุรกิจด้านการออกแบบ (Design Business Entrepreneur)
25520051102782,ผู้ประสานงานด้านการออกแบบ (Design Coordinator)
25520051102782,นักวิจัย-วิชาการออกแบบผลิตภัณฑ์
25520051102782,บุคลากรทางการศึกษาด้านศิลปะออกแบบ
25520051102782,นักออกแบบผลิตภัณฑ์หัตถอุตสาหกรรม
25520051102782,นักออกแบบผลิตภัณฑ์อุตสาหกรรม
25520051102782,นักออกแบบผลิตภัณฑ์เครื่องเรือน
25520051102782,นักออกแบบกราฟิก เลขนภัณฑ์บรรจุภัณฑ์
25520051102782,นักออกแบบศิลปะและผลิตภัณฑ์เซรามิกส์
25520051102782,นักออกแบบนิทรรศการและบริเวณจัดแสดง
25520051102782,นักพัฒนาผลิตภัณฑ์ชุมชน-วิสาหกิจชุมชน
25520051102782,นักจัดการบริหารงานออกแบบ และนักออกแบบอิสระ
25520051102782,ผู้ประกอบการงานออกแบบ
25520051102782,อาชีพอื่น ๆ ที่เกี่ยวข้องกับการออกแบบ
25550051100164,นักพัฒนาสังคม
25550051100164,นักการเมือง
25550051100164,ปลัดอำเภอ
25550051100164,นักวิชาการศึกษา
25550051100164,นักการทูต และเจ้าหน้าที่ในองค์กรระหว่างประเทศ
25550051100164,เจ้าหน้าที่บุคคล
25550051100164,ผู้สื่อข่าว
25550051100164,นักธุรกิจ
25550051100164,นักวิชาการและนักวิจัย
25550051100164,เจ้าของกิจการและอาชีพอิสระอื่นๆ
,-นักพัฒนาสังคมหน่วยงานภาครัฐ องค์กรพัฒนาเอกชน และหน่วยงานเอกชน/ธุรกิจ
,-นักขับเคลื่อนสังคมในองค์กรระหว่างประเทศ
,-นักการเมืองระดับท้องถิ่น และระดับชาติ
,-นักพัฒนาทรัพยากรมนุษย์
,-นักวิเคราะห์ตลาด นักการตลาด
,-ผู้ประกอบการ
,-นักเขียน สื่อมวลชน
,-บุคลากรในสายงานปกครอง เช่น เจ้าหน้าที่วิเคราะห์แผนและนโยบาย ปลัดอำเภอ
,-บุคลากรในสายงานการระหว่างประเทศ เช่น เจ้าหน้าที่ในกระทรวงการต่างประเทศ
,-บุคลากรในสายงานวิชาการและบริหารการศึกษา เช่น นักวิจัย อาจารย์ นักวิชาการศึกษา
25410051100192,ผู้อำนวยการผลิต (Producer)
25410051100192,ผู้อำนวยการบริหาร (Executive Director/Managing Director)
25410051100192,ผู้กำกับศิลป์ (Artistic Director)
25410051100192,ผู้กำกับการแสดง (Director)
25410051100192,ผู้ช่วยผู้กำกับการแสดง (Assistant Director)
25410051100192,ผู้เขียนบทละคอน (Playwright)
25410051100192,"นักออกแบบกิจกรรมในการใช้ละคอนประยุกต์ (Creative Designer/Facilitator
for Applied Theatre)"
25410051100192,นักออกแบบฉากและเวทีสำหรับการแสดง (Set Designer)
25410051100192,นักออกแบบเครื่องแต่งกายสำหรับการแสดง (Costume Designer)
25410051100192,ศิลปินสร้างสรรค์งานแต่งหน้า (Make up Artsist)
25410051100192,ผู้ออกแบบภาพลักษณ์ (Stylist)
25410051100192,ผู้จัดการเวที (Stage Manager)
25410051100192,ผู้จัดการงานอีเว้นท์ (Event Organizer)
25410051100192,นักแสดง (Actor)
25410051100192,ผู้ฝึกหัดนักแสดง (Acting Coach)
25410051100192,ครู/อาจารย์/ผู้สอนด้านการละคอน (Teacher/Performance Instructor)
25400051100112,นักออกแบบสิ่งทอและแฟชั่น
25400051100112,นักจัดการสินค้าสิ่งทอและแฟชั่น
25400051100112,ผู้ประกอบการในการผลิตและจำหน่ายงานประเภทสิ่งทอและแฟชั่น
25400051100112,นักพัฒนาผลิตภัณฑ์
25400051100112,นักวิชาการทางด้านการออกแบบสิ่งทอและแฟชั่น
25400051100112,ผู้ออกแบบรูปแบบการแต่งกาย (stylist)
25400051100112,นักออกแบบในสาขาที่เกี่ยวข้อง
25400051100393,ประกอบอาชีพเป็นนักวิทยาศาสตร์ นักวิจัย นักวิชาการ บุคลากรทางการศึกษา ในหน่วยงานของรัฐ รัฐวิสาหกิจ หรือหน่วยงานด้านอุตสาหกรรมของภาคเอกชน รวมทั้งเป็นผู้ประกอบการทางด้านวิทยาศาสตร์และเทคโนโลยี หรือบุคคลที่มีศักยภาพทางวิชาการด้านฟิสิกส์สำหรับศึกษาต่อในขั้นสูง
25480051100414,นักออกแบบผลิตภัณฑ์หัตถอุตสาหกรรม
25480051100414,นักออกแบบผลิตภัณฑ์อุตสาหกรรม
25480051100414,นักออกแบบผลิตภัณฑ์เครื่องเรือน
25480051100414,นักออกแบบกราฟฟิก เลขนภัณฑ์ บรรจุภัณฑ์
25480051100414,นักออกแบบศิลปะและผลิตภัณฑ์เซรามิกส์
25480051100414,นักออกแบบนิทรรศการและบริเวณจัดแสดง
25480051100414,นักพัฒนาผลิตภัณฑ์ชุมชน-วิสาหกิจชุมชน
25480051100414,นักจัดการงานออกแบบ
25480051100414,นักออกแบบอิสระ ผู้ประกอบการงานออกแบบ
25400051100189,นักการเมือง หน่วยงานราชการ ปลัดอำเภอ นักพัฒนาชุมชน นักปกครอง
25400051100189,นักวิชาการศึกษา
25400051100189,นักการทูต องค์กรระหว่างประเทศ และหน่วยงานระหว่างประเทศต่าง ๆ
25400051100189,นักบริหารงานทั่วไป เจ้าหน้าที่บุคคล นักธุรกิจ ผู้จัดการทั่วไป ผู้สื่อข่าว
25490051100461,"นักวารสารศาสตร์ (ผู้สื่อข่าว, นักเขียน,นักวิจารณ์, นักวิเคราะห์, นักสร้างสรรค์เนื้อหา)"
25490051100461,บรรณาธิการและกองบรรณาธิการข่าว
25490051100461,ผู้ผลิตสื่อ ผู้ประกอบการสื่อ
25490051100461,"นักการสื่อสารที่สามารถทำงานให้องค์กรต่างๆ เช่น องค์กรภาครัฐ ภาคเอกเชน
NGO และ องค์กรระหว่างประเทศ"
25400051100101,นักข่าว นักเขียน นักวิจารณ์ นักสร้างสรรค์เนื้อหา
25400051100101,งานบรรณาธิการ การพิมพ์ และการออกแบบสิ่งพิมพ์
25400051100101,ผู้ผลิตรายการ ผู้ผลิตเนื้อหาสำหรับสื่อวิทยุ โทรทัศน์ดิจิทัล และสตรีมมิ่ง
25400051100101,เจ้าหน้าที่ด้านสื่อสารในองค์กรของรัฐและเอกชน
25400051100101,เจ้าของธุรกิจที่เกี่ยวข้องกับสื่อขนาดเล็กและผู้ประกอบการสังคมด้านงานสื่อและการสื่อสาร
25400051100101,นักโฆษณา และนักสื่อสารการตลาด
25400051100101,นักวิจัยโฆษณา
25400051100101,นักบริหารตราสินค้า นักออกแบบ และผลิตงานโฆษณา
25400051100101,นักวางแผนกิจกรรมพิเศษทางการตลาด
25400051100101,ช่างภาพ
25400051100101,ผู้กำกับภาพยนตร์ ผู้ช่วยผู้กำกับภาพยนตร์ ประสานงานกองถ่ายภาพยนตร์
25590051100113,นวัตกรและผู้ประกอบการสังคม
25590051100113,กระบวนกรหรือวิทยากรกระบวนการ
25590051100113,นักเทคโนโลยีการศึกษาและการเรียนรู้
25590051100113,นักออกแบบสื่อการเรียนการสอน
25590051100113,นักออกแบบและจัดการเรียนรู้
25590051100113,นักวิจัยด้านการเรียนรู้และการศึกษา
25590051100113,นักสื่อสารและประสานองค์ความรู้
25400051100202,นักสังคมสงเคราะห์วิชาชีพ
25400051100202,นักจัดการรายกรณี
25400051100202,นักพัฒนาสังคม
25400051100202,นักสวัสดิการสังคม
25400051100202,นักพัฒนาชุมชน
25400051100202,นักทัณฑวิทยา
25400051100202,พนักงานคุมประพฤติ
25400051100202,พนักงานไกล่เกลี่ยข้อพิพาท
25400051100202,พนักงานคุ้มครองสิทธิ
25400051100202,เจ้าหน้าที่พัฒนาทรัพยากรมนุษย์
25400051100202,นักวิเคราะห์นโยบายและแผน
25400051100202,นักวิชาการ
25400051100202,นักวิจัย
25400051100202,เจ้าหน้าที่บริหารงานทั่วไป
25400051100202,ผู้ประสานงานโครงการ
25400051100202,ผู้ประกอบการทางสังคม
25400051100202,นักจัดการความรู้
25400051100202,อื่น ๆ
25400051100202,นักสังคมสงเคราะห์วิชาชีพ
25400051100202,นักจัดการรายกรณี
25400051100202,นักพัฒนาสังคม
25400051100202,นักสวัสดิการสังคม
25400051100202,นักพัฒนาชุมชน
25400051100202,นักทัณฑวิทยา
25400051100202,พนักงานคุมประพฤติ
25400051100202,พนักงานไกล่เกลี่ยข้อพิพาท
25400051100202,พนักงานคุ้มครองสิทธิ
25400051100202,เจ้าหน้าที่พัฒนาทรัพยากรมนุษย์
25400051100202,นักวิเคราะห์นโยบายและแผน
25400051100202,นักวิชาการ
25400051100202,นักวิจัย
25400051100202,เจ้าหน้าที่บริหารงานทั่วไป
25400051100202,ผู้ประสานงานโครงการ
25400051100202,ผู้ประกอบการทางสังคม
25400051100202,นักจัดการความรู้
25400051100202,อื่น ๆ
25400051100415,นักวิทยาศาสตร์
25400051100415,นักวิจัย
25400051100415,นักวิชาการ
25400051100415,พนักงานราชการ หรือรัฐวิสาหกิจ
25400051100415,ผู้ประกอบการ หรือลูกจ้างในหน่วยงานอุตสาหกรรมของภาคเอกชน
25400051100415,อาชีพอิสระ
