curr_id,career
25420051100193,บุคลากรในสายอาชีพด้านสื่อสารมวลชน
25420051100193,นักแปล ล่าม นักเขียน นักวิจารณ์
25420051100193,ผู้ประกอบการ หรือนักธุรกิจในภูมิภาคที่ตนศึกษา
25420051100193,ข้าราชการในหน่วยงานของรัฐ เช่น กระทรวงการต่างประเทศ
25420051100193,เจ้าหน้าที่สถานทูต องค์กรระหว่างประเทศ
25420051100193,พนักงานในหน่วยงานของรัฐหรือเอกชนที่ใช้ภาษาอังกฤษในการสื่อสาร
25500051100574,พนักงานในบริษัทเอกชน
25500051100574,พนักงานในองค์กรระดับชาติและนานาชาติ
25500051100574,นักธุรกิจ ผู้ประกอบการ เจ้าของกิจการธุรกิจที่เกี่ยวข้องกับต่างประเทศ
25500051100574,เจ้าหน้าที่องค์กรระหว่างประเทศ นักการทูต
25500051100574,นักแปล ล่าม
25500051100574,อาชีพที่เกี่ยวข้องในอุตสาหกรรมท่องเที่ยวและบริการ และการสื่อสาร
,นักแปลและล่าม
,บรรณาธิการงานแปล/ผู้ตรวจสอบงานแปล
,นักโลคัลไลเซชัน/ผู้เชี่ยวชาญด้านโลคัลไลเซชัน
,ผู้บริหารโครงการแปล/ผู้บริหารโครงการโลคัลไลเซชัน
,นักพัฒนาเทคโนโลยีและเครื่องมือช่วยแปล
,นักวิจัย/อาจารย์
25410051100225,นักวิเคราะห์ระบบและนักวิเคราะห์ข้อมูล
25410051100225,นักออกแบบและนักจัดการงานระบบการผลิตการดำเนินงานในโรงงานอุตสาหกรรม
25410051100225,ครู อาจารย์
25410051100225,นักวิจัย นักวิชาการ
25410051100225,งานวิจัยในแผนกการวางแผนและพัฒนาของหน่วยงานภาครัฐและเอกชน
25410051100225,งานด้านประกันภัย ประกันชีวิต
25410051100225,นักวางแผนทางการเงิน งานด้านการเงิน การธนาคาร
25410051100225,ผู้พัฒนาซอฟต์แวร์หรือโปรแกรมเมอร์
25410051100225,นักออกแบบระบบการผลิตการดำเนินงานในโรงงานอุตสาหกรรมหรือสายการบิน
25410051100225,อาชีพอื่น ๆ ในหน่วยงานราชการและเอกชน ที่ใช้ทักษะความรู้ทางด้านคณิตศาสตร์ประยุกต์
25570051102304,ผู้จัดการออกแบบ นักวางแผนฝ่ายพัฒนาธุรกิจและผลิตภัณฑ์ใหม่
25570051102304,นวัตกรทางด้านการออกแบบ
25570051102304,ผู้ประกอบการอิสระ
,"นักพัฒนาซอฟต์แวร์ นักพัฒนาเอพีไอ ผู้มีความสามารถในการวิเคราะห์และปรับปรุงสมรรถนะ
ของโปรแกรม"
,นักวิทยาการข้อมูล นักวิเคราะห์ข้อมูล ผู้ใส่คำประกอบชุดข้อมูล
,"นักพัฒนาบนระบบประมวลผลสมรรถนะสูง ผู้ดูแลระบบคลาวด์ เจ้าหน้าที่คอมพิวเตอร์เพื่องาน
คำนวณสมรรถนะสูง"
,อาชีพและสายงานที่เกี่ยวข้องกับปัญญาประดิษฐ์
,"นักพัฒนาระบบสมองกลฝังตัว นักพัฒนาไอโอที นักพัฒนาผลิตภัณฑ์ดิจิทัล และนวัตกรรมด้าน
ไอโอที"
,"นักออกแบบผลิตภัณฑ์ดิจิทัล นักวิเคราะห์ธุรกิจ นักออกแบบระบบติดต่อกับผู้ใช้ นักออกแบบ
ผลิตสื่อดิจิทัลแบบปฏิสัมพันธ์"
,"นักวิชาการคอมพิวเตอร์ เจ้าหน้าที่คอมพิวเตอร์ เจ้าหน้าที่สารสนเทศ เจ้าหน้าที่สนับสนุนและ
บริการระบบสารสนเทศ ในหน่วยงานของรัฐ เอกชน ตำรวจ ทหาร สถานพยาบาล"
,"เจ้าของกิจการ สตาร์ตอัป สำหรับพัฒนาผลิตภัณฑ์ดิจิทัล หรือกิจการที่ให้บริการด้านสารสนเทศ
รับจ้างจัดเก็บข้อมูล ติดตั้งระบบไอโอที จัดทำชุดข้อมูล ใส่คำประกอบชุดข้อมูล"
,นักเขียนบทความอิสระ ผู้ดูแลเว็บไซต์
,ผู้ช่วยจัดการฝึกอบรมด้านไอที ผู้ช่วยวิจัย อาจารย์ผู้ช่วยสอนวุฒิปริญญาตรี
25630051100104,นักการเมือง
25630051100104,ผู้สื่อข่าว
25630051100104,เจ้าหน้าที่หน่วยงานรัฐและรัฐวิสาหกิจ
25630051100104,เจ้าหน้าที่บุคคล
25630051100104,นักการทูต และเจ้าหน้าที่ในองค์กรระหว่างประเทศ
25630051100104,พนักงานบริษัทเอกชนทั้งในต่างประเทศ
25630051100104,นักธุรกิจ
25630051100104,เจ้าของกิจการและอาชีพอิสระอื่นๆ
25630051100104,นักวิชาการและนักวิจัย
25570051100234,เจ้าหน้าที่พัฒนาธุรกิจ หน้าที่ และความรับผิดชอบ (CSR)
25570051100234,นักวางแผน
25570051100234,นักวิชาการ
25570051100234,นักปฏิบัติการเชิงวิชาชีพทางการสื่อสารเพื่อขับเคลื่อนนวัตกรรม
25570051100234,นักสื่อสารสังคม
25570051100234,นักพัฒนาองค์กร
25570051100234,นักออกแบบนวัตกรรมสังคม
25550051103459,ประกอบวิชาชีพอิสระ
25550051103459,ทำงานในหน่วยงานราชการ องค์กรที่ไม่แสวงหากำไร
25550051103459,"ทำงานบริษัทที่ปรึกษาโครงการที่เกี่ยวข้องกับการออกแบบและพัฒนาชุมชนเมือง ได้หลายประเภท ทั้งในและ
ต่างประเทศ"
25510051102263,นักการทูต
25510051102263,ข้าราชการหรือผู้แทนรัฐบาลไทยในต่างประเทศ
25510051102263,เจ้าหน้าที่องค์กรระหว่างประเทศ
25510051102263,เจ้าหน้าที่สื่อสารมวลชน
25510051102263,เจ้าหน้าที่บริหารด้านต่างประเทศ บริษัทเอกชน
25520051102815,ผู้ประกอบการธุรกิจส่วนตัว
25520051102815,นักวิจัยและนักวิชาการด้านการพัฒนา
25520051102815,พนักงานบริษัท
25520051102815,พนักงานราชการ พนักงานท้องถิ่น และพนักงานรัฐวิสาหกิจ
25520051102815,อาชีพอิสระ
25520051102815,อาจารย์
25500051100585,"หลักสูตรวิทยาศาสตรบัณฑิตเป็นหลักสูตรต่อเนื่อง 4+2 ปี ที่นักศึกษาต้องเรียนต่อในหลักสูตร
สถาปัตยกรรมมหาบัณฑิต ถ้านักศึกษาสิ้นสุดการศึกษาในระดับปริญญาตรี จะต้องมีประสบการณ์ทำงาน
เพิ่มเติมตามที่สภาสถาปนิกกำหนด จึงจะสามารถขอสอบใบอนุญาตประกอบวิชาชีพสถาปัตยกรรมควบคุมได้"
25470051100378,นักวิชาการด้านการจัดการสิ่งแวดล้อมในหน่วยงานราชการที่เกี่ยวข้องกับระบบการจัดการ ควบคุม และตรวจสอบด้านสิ่งแวดล้อม เช่น กระทรวงทรัพยากรธรรมชาติและสิ่งแวดล้อม กระทรวง อุตสาหกรรม ตลอดจนหน่วยงานอื่นๆ ที่เกี่ยวข้อง
25470051100378,นักวิชาการในบริษัทเอกชนหรือรัฐวิสาหกิจ เช่น สถาบันวิจัยและพัฒนางานด้านสิ่งแวดล้อม บริษัทที่ให้คำปรึกษางานด้านสิ่งแวดล้อม โรงงานอุตสาหกรรม นิคมอุตสาหกรรม บริษัทเอกชน สถาบันวิจัยวิทยาศาสตร์และเทคโนโลยีแห่งประเทศไทย ตลอดจนหน่วยงานอื่นๆ ที่เกี่ยวข้อง
25470051100378,ประกอบธุรกิจส่วนตัวทางด้านการจัดการหรือเทคโนโลยีสิ่งแวดล้อม
25470051100378,อาชีพอิสระ
25400051100213,อาจารย์ในสถาบันการศึกษาทั้งภาครัฐและเอกชน
25400051100213,"นักวิจัย นักวิชาการเกษตร และนักส่งเสริมการเกษตรทั้งในภาครัฐและเอกชน เช่น กรม
วิชาการเกษตร กรมส่งเสริมการเกษตร กรมปศุสัตว์ และบริษัทเอกชนด้านการเกษตร เป็นต้น"
25400051100213,ประกอบธุรกิจการเกษตร
25400051100213,ศึกษาต่อในระดับบัณฑิตศึกษา
25610051100036,นักเทคโนโลยีในสถานประกอบการ
25610051100036,ผู้ประกอบการอุตสาหกรรม
25610051100036,นักวิจัยและนักวิทยาศาสตร์ทั้งในหน่วยงานราชการและเอกชน
25610051100036,พนักงานราชการและพนักงานรัฐวิสาหกิจ
25610051100036,อาจารย์ทั้งในหน่วยงานราชการและเอกชน
25610051100036,อาชีพอิสระ
25610054001377,นักบริหารดิจิทัล
25610054001377,นักวิเคราะห์ข้อมูล
25610054001377,นักการตลาดดิจิทัล
25610054001377,ผู้ปฏิบัติงานด้าน Cyber Security
25610054001377,พนักงานองค์การด้านนวัตกรรม
25610054001377,พนักงานองค์กรฝ่ายวิเคราะห์และวางแผนโครงการทางดิจิทัล
25520051102624,นักวิชาการสายวิทยาการคอมพิวเตอร์ หรือนักวิทยาศาสตร์คอมพิวเตอร์
25520051102624,นักวิเคราะห์และออกแบบระบบงานสารสนเทศ
25520051102624,ผู้พัฒนาซอฟต์แวร์
25520051102624,ผู้ดูแลระบบเครือข่ายและเครื่องแม่ข่าย
25520051102624,ผู้ดูแลระบบฐานข้อมูล
25520051102624,ผู้จัดการโครงการซอฟต์แวร์
25520051102624,ผู้ประสานงานโครงการซอฟต์แวร์
25520051102624,ผู้ประกอบการทางด้านซอฟต์แวร์
25520051102624,นักพัฒนาเว็บไซต์
25520051102624,นักพัฒนาแอปพลิเคชันบนมือถือ
25520051102624,นักวิทยาการข้อมูล นักวิเคราะห์ข้อมูล
25520051102624,นักวิชาชีพในสถานประกอบการที่มีการใช้วิทยาการคอมพิวเตอร์
,ผู้อำนวยการผลิต (Producer)
,ผู้อำนวยการบริหาร (Executive Director/Managing Director)
,ผู้จัดการงานอีเว้นท์ (Event Organizer)
,นักจัดการศิลปะ (Arts Administrator)
,ภัณฑารักษ์ (Senior Curator)
,นักจัดการศิลปะวัฒนธรรม (Cultural Arts Manager)
,ผู้ดูแลการเข้าชม (Admission Attendant)
,ผู้ช่วยแกลเลอรี่ (Gallery Assistant)
,นักจัดการพิพิธภัณฑ์ (Museum Administrator)
,นักจัดการธุรกิจดนตรี (Music Business Manager)
,ผู้จัดการหอศิลป์ (Art Gallery Manager)
,ผู้จัดการเทศการศิลปะแขนงต่างๆ (Festival Manager)
,ผู้จัดการโครงการที่เกี่ยวกับศิลปะ (Arts Project Manager)
,ผู้จัดการงานที่เกี่ยวข้องกับการแสดง (Show Manager)
,ผู้จัดการกองถ่าย (Production Manager)
,ผู้จัดการธุรกิจแฟชั่นและสิ่งทอ (Fashion and Textile Business Manager)
,ผู้ผลิตนโยบายศิลปะ (Arts Policy Maker)
25570051102416,พนักงานและผู้ประกอบการด้านมรดกวัฒนธรรม
25570051102416,พนักงานและผู้ประกอบการด้านอุตสาหกรรมสร้างสรรค์
25570051102416,บุคลากรสายวิชาการ และพนักงานสายสนับสนุนด้านการจัดการมรดกวัฒนธรรมและอุตสาหกรรมสร้างสรรค์
25570051102416,นักวิจัยหรือผู้ช่วยนักวิจัยในโครงการขององค์การยูเนสโก และงานด้านวัฒนธรรมอื่น ๆ ที่เกี่ยวข้อง
25570051102416,ภัณฑารักษ์หรือผู้ดูแลพิพิธภัณฑ์
25570051102416,พนักงานองค์กรฝ่ายการตลาดและการประชาสัมพันธ์ทางวัฒนธรรม
25570051102416,พนักงานองค์กรฝ่ายวิเคราะห์และวางแผนโครงการทางวัฒนธรรม
25570051102416,พนักงานองค์กรฝ่ายประสานงานโครงการทางวัฒนธรรมและโครงการอื่น ๆ ที่เกี่ยวข้อง
25570051102416,พนักงานองค์กรด้านการออกแบบสื่อวัฒนธรรมสร้างสรรค์
25570051102416,เจ้าหน้าที่บริษัทผลิตรายการโทรทัศน์และภาพยนตร์และสื่อสมัยใหม่
25570051102416,เจ้าหน้าที่บริษัทรับจัดงานและการแสดงทางวัฒนธรรม (Event)
25570051102416,อาชีพอิสระ เช่น ผู้ผลิตงานสร้างสรรค์ (ภาพยนตร์ เพลง ศิลปะการแสดง ฯลฯ) ผู้ประกอบกิจการสตาร์ทอัป (Startup)
25570051102405,พนักงานฝ่ายลูกค้าสัมพันธ์ ฝ่ายบริการของโรงแรม สายการบิน และธุรกิจนำเที่ยว
25570051102405,พนักงานฝ่ายบริการของโรงพยาบาล
25570051102405,พนักงานฝ่ายบริการของธนาคาร สถาบันการเงิน
25570051102405,พนักงานฝ่ายการวางแผนการจัดงานอีเวนท์
25570051102405,เจ้าของธุรกิจที่เกี่ยวข้องกับการบริการ
25520051102782,อาจารย์
25520051102782,นักวิจัย
25520051102782,นักวิชาการศึกษาด้านจีนศึกษา
25520051102782,นักวิชาการศึกษาในสถาบันอุดมศึกษา
25520051102782,เจ้าหน้าที่วิเคราะห์นโยบายและแผน
25520051102782,เจ้าหน้าที่สถานทูตและองค์กรระหว่างประเทศ
25520051102782,ล่าม/นักแปล
25520051102782,ผู้ประกอบการสินค้าและตลาดไทย-จีน
25520051102782,ธุรกิจนำเข้า-ส่งออก
25520051102782,ธุรกิจ Start Up
25520051102782,เจ้าหน้าที่ในองค์กรพัฒนาเอกชน (NGO)/องค์กรไม่แสวงหาผลกำไร ฯลฯ
25520051102782,อาจารย์
25520051102782,นักวิจัย
25520051102782,นักวิชาการด้านอนุภูมิภาคลุ่มน้ำโขง
25520051102782,นักวิชาการศึกษาในสถาบันอุดมศึกษา
25520051102782,นักพัฒนาสังคมท้องถิ่น
25520051102782,เจ้าหน้าที่วิเคราะห์นโยบายและแผน
25520051102782,"เจ้าหน้าที่สถานทูตและองค์กรระหว่างประเทศนักพัฒนาสินค้าและบริการ,ล่าม"
25520051102782,ผู้ประกอบการสินค้าและตลาดไทย-อนุภูมิภาคลุ่มน้ำโขง
25520051102782,ธุรกิจนำเข้า-ส่งออก
25520051102782,ธุรกิจ Start Up
25520051102782,ผู้ประกอบการธุรกิจรายย่อย
25520051102782,ผู้ประกอบการทางสังคม
25520051102782,เจ้าหน้าที่ในองค์กรพัฒนาเอกชน (NGO)
25520051102782,เจ้าหน้าที่ประสานงานธุรกิจระหว่างประเทศ
25520051102782,เลขานุการ
25520051102782,นักพัฒนาการท่องเที่ยว
25520051102782,นักส่งเสริมการท่องเที่ยว
25520051102782,นักวิชาการท่องเที่ยว
25520051102782,ผู้ประกอบการที่พัก
25520051102782,ร้านอาหาร
25520051102782,ร้านขายของที่ระลึก
25520051102782,Blogger สายท่องเที่ยว
25520051102782,นักรีวิวสถานที่ท่องเที่ยว
25520051102782,ผู้ประกอบการบริษัทนำเที่ยว
25520051102782,มัคคุเทศก์ส่วนตัว
25520051102782,นักออกแบบและวางแผนการท่องเที่ยว
25520051102782,ผู้ประกอบการธุรกิจในอุตสาหกรรมท่องเที่ยว
25520051102782,ฝ่ายประสานงานบริษัททัวร์
25520051102782,ที่ปรึกษาการด้านท่องเที่ยว
25520051102782,ฝ่ายบริการข้อมูลลูกค้าด้านสถานที่ท่องเที่ยว
25520051102782,เจ้าหน้าที่ออกแบบโปรแกรมนำเที่ยว
25520051102782,ฝ่ายประชาสัมพันธ์
25520051102782,พนักงานฝ่ายต้อนรับส่วนหน้า
25520051102782,ฝ่ายธุรการ
25520051102782,พนักงานบริการบนเรือสำราญ
25520051102782,เจ้าหน้าที่ประสานโครงการภาครัฐและเอกชน
25520051102782,เจ้าหน้าที่ฝ่ายทำธุรกิจเพื่อสังคม
25520051102782,เจ้าหน้าที่ในองค์กรพัฒนาเอกชน (NGO)
25520051102782,เจ้าหน้าที่ในองค์กรปกครองส่วนท้องถิ่น
25520051102782,เจ้าหน้าที่ฝ่ายบุคคลหรือพัฒนาทรัพยากรมนุษย์
25520051102782,เจ้าหน้าที่หอศิลป์และพิพิธภัณฑ์
25520051102782,เจ้าหน้าที่ฝึกอบรมและเจ้าหน้าที่กิจกรรมเพื่อสังคม
25520051102782,ผู้จัดการในธุรกิจท่องเที่ยวและบริการ
25520051102782,ผู้ประกอบการธุรกิจ Start Up
25520051102782,ผู้ประกอบการเกี่ยวกับสินค้าในชุมชน
25520051102782,ผู้ประกอบการอุตสาหกรรมวัฒนธรรม
25520051102782,นักออกแบบนวัตกรรมสังคม (Social Innovation Designer)
25520051102782,นักออกแบบผลิตภัณฑ์ (Product Designer)
25520051102782,นักออกแบบบริการ (Service Designer)
25520051102782,นักออกแบบสื่อสาร (Communication Designer)
25520051102782,นักออกแบบเพื่อชุมชน (Community Designer)
25520051102782,นักออกแบบประสบการณ์ (Experience Designer)
